text,answer,a,b,c,d,e,f,g,h,hint,feedback,implausible_distractors,none_of_the_above,all_of_the_above,fill_in_the_blank,true_or_false,absolute_terms,longest_answer_correct,negative_worded_stem,word_repeats_in_stem_and_correct_answer,avoid_logical_cues,lost_sequence,more_than_one_correct,complex_k_type,ambiguous_unclear_information,gratuitous_information_in_stem,avoid_convergence_cues,grammatical_cues_in_stem,vague_terms,unfocused_stem
Which code loads the package\n`seaborn`\nwith the alias\n`sns`\n?,import seaborn as sns,from seaborn import scatterplot,import seaborn as sns,import sns as seaborn,library(seaborn),,,,,,,Pass,Pass,Pass,Pass,Pass,Pass,Pass,Pass,Pass,Pass,Pass,Pass,Pass,Pass,Pass,Pass,Pass,Pass,Pass
Which code loads the function\n`read_csv`\nfrom the package\n`pandas`\n?,`from pandas import read_csv`,`from pandas import read_csv`,`from read_csv import pandas`,`import pandas as read_csv`,`import pandas.read_csv`,,,,,,,Pass,Pass,Pass,Pass,Pass,Pass,Pass,Pass,Pass,Pass,Pass,Pass,Pass,Pass,Pass,Pass,Pass,Pass,Pass
Which best describes the package\n`pandas`\n?,Provides methods and classes for tabular and time-series data,Allows the creation of data visualizations,Includes functions and classes that aid in numerical computation,"Provides algorithms and functions for computing problems that arise in science, engineering and statistics",Provides methods and classes for tabular and time-series data,,,,,,,Pass,Pass,Pass,Pass,Pass,Pass,Pass,Pass,Pass,Pass,Pass,Pass,Pass,Pass,Pass,Pass,Pass,Pass,Pass
Which package allows the creation of data visualizations and works well with\n`pandas`\n?,`seaborn`,`numpy`,`seaborn`,`scipy`,`sklearn`,,,,,,,Pass,Pass,Pass,Pass,Pass,Pass,Pass,Pass,Pass,Pass,Pass,Pass,Pass,Pass,Pass,Pass,Pass,Pass,Pass
"A/An _____ installs, updates, and removes packages.",package manager,dependency,installer,package manager,terminal,,,,,,,Pass,Pass,Pass,Fail,Pass,Pass,Pass,Pass,Pass,Pass,Pass,Pass,Pass,Pass,Pass,Pass,Pass,Pass,Pass