text,answer,a,b,c,d,e,f,g,h,hint,feedback
What does the index variable represent in a summation \(\sum_{i=s}^t a_i\)?,The variable being summed,A constant term,The variable being summed,The upper limit,The lower limit,,,,,,
What is the value of \(\sum_{j=1}^4 j^3\)?,100,64,36,100,50,,,,,,
How can \(\sum_{k=m}^n a_k\) be expressed by pulling out the last term?,\(\sum_{k=m}^{n-1} a_k + a_n\),\(\sum_{k=m}^{n+1} a_k - a_n\),\(\sum_{k=m}^{n-1} a_k + a_n\),\(\sum_{k=m}^{n-1} a_k - a_n\),\(\sum_{k=m+1}^n a_k + a_m\),,,,,,
"When substituting \(i = k + 2\) in \(\sum_{k=1}^n (k+2)^3\), what is the new lower limit for \(i\)?",3,1,0,3,\(n+2\),,,,,,
"If \(j = i + 2\), what is the expression for \(i\) in terms of \(j\)?",\(j - 2\),\(j + 2\),\(j - 2\),\(2 - j\),\(2j\),,,,,,
What is the closed form for the sum of an arithmetic sequence \(\sum_{k=0}^{n-1} (a + kd)\)?,\(an + \frac{d(n-1)n}{2}\),\(an + \frac{d(n+1)n}{2}\),\(an + \frac{d(n-1)n}{2}\),\(a + d(n-1)n\),\(a + dn\),,,,,,
Which formula represents the closed form for the sum of a geometric sequence \(\sum_{k=0}^{n-1} a \cdot r^k\) with \(r \neq 1\)?,\(\frac{a(r^n-1)}{r-1}\),\(\frac{a(r^{n+1}-1)}{r-1}\),\(\frac{a(r^n-1)}{r-1}\),\(a \cdot r^n\),\(a + r^n\),,,,,,
What is the sum \(\sum_{k=0}^4 2^k\)?,31,31,15,16,20,,,,,,
Why are \(\sum_{j=0}^{100} j^3\) and \(\sum_{j=1}^{100} j^3\) equal?,Because \(0^3 = 0\) and does not affect the sum,Because the sums have different indices,Because \(0^3 = 0\) and does not affect the sum,Because the upper limits are the same,Because the index variable can be changed arbitrarily,,,,,,
How is the total sales projection after one year calculated if sales grow 10% monthly starting at 1000 widgets?,\(1000 \sum_{k=0}^{11} (1.1)^k = \frac{1000((1.1)^{12} - 1)}{1.1 - 1}\),\(1000 \times 12 \times 1.1\),\(1000 \sum_{k=0}^{11} (1.1)^k = \frac{1000((1.1)^{12} - 1)}{1.1 - 1}\),\(1000 \times (1.1)^{12}\),\(12 \times 1000\),,,,,,
"When changing the index variable from \(j\) to \(k\) using \(k = j -1\) in \(\sum_{j=1}^{17} 2^{j-1}\), what is the new summation?",\(\sum_{k=0}^{16} 2^k\),\(\sum_{k=1}^{17} 2^{k-1}\),\(\sum_{k=0}^{16} 2^k\),\(\sum_{k=1}^{16} 2^k\),\(\sum_{k=0}^{17} 2^{k-1}\),,,,,,
The symbol \(\Sigma\) in summation notation represents the _____ of terms.,sum,product,difference,sum,division,,,,,,
What is the upper limit in \(\sum_{i=3}^n a_i\)?,\(n\),3,\(n\),\(a_i\),\(i\),,,,,,
Pulling out the last term from \(\sum_{k=1}^n a_k\) creates which equivalent expression?,\(\sum_{k=1}^{n-1} a_k + a_n\),\(\sum_{k=1}^{n} a_k + a_n\),\(\sum_{k=1}^{n-1} a_k + a_n\),\(\sum_{k=1}^{n-1} a_k - a_n\),\(\sum_{k=1}^{n} a_k - a_n\),,,,,,
"If \(i = k + 2\), then the summation \(\sum_{k=1}^n (k+2)^3\) becomes",\(\sum_{i=3}^{n+2} i^3\),\(\sum_{i=1}^{n+2} i^3\),\(\sum_{i=3}^{n+2} i^3\),\(\sum_{i=3}^{n} i^3\),\(\sum_{i=1}^{n} i^3\),,,,,,
The closed form for the sum of \(n\) terms of an arithmetic sequence with initial term \(a\) and difference \(d\) is:,\(an + \frac{d(n-1)n}{2}\),\(an + \frac{d(n-1)n}{2}\),\(a + d \cdot n\),\(\frac{a(n^2)}{d}\),\(\frac{a + d}{n}\),,,,,,
"In the geometric sum \(\sum_{k=0}^{n-1} a r^k\), what is the closed form expression?",\(\frac{a(r^{n} - 1)}{r-1}\),\(\frac{a(r^{n} - 1)}{r-1}\),\(a r^{n-1}\),\(a \cdot r \cdot n\),\(\frac{r^{n} - 1}{a(r-1)}\),,,,,,
Why can the index variable in a summation be replaced with another variable?,It is internal and arbitrary,It changes the sum value,It is internal and arbitrary,It affects the limits,It changes the terms,,,,,,
"When substituting \(j = i + 2\) in \(\sum_{i=3}^{21} \frac{1}{i+3}\), what is the new lower limit?",5,3,5,1,21,,,,,,
What happens to the summation limits when the index variable is changed by \(i = k + 2\)?,Limits increase by 2,Limits decrease by 2,Limits increase by 2,Limits stay the same,Limits become zero,,,,,,
How does the term inside the summation change under variable substitution \(i = j - 2\) for \(\frac{1}{i+3}\)?,\(\frac{1}{j + 1}\),\(\frac{1}{j - 1}\),\(\frac{1}{j + 1}\),\(\frac{1}{j + 2}\),\(\frac{1}{j - 3}\),,,,,,
Why are closed form expressions preferred over expanded summations?,They provide the sum value directly and efficiently,They always have fewer terms,They provide the sum value directly and efficiently,They avoid using variables,They only apply to geometric sequences,,,,,,
