text,answer,a,b,c,d,e,f,g,h,hint,feedback,implausible_distractors,none_of_the_above,all_of_the_above,fill_in_the_blank,true_or_false,absolute_terms,longest_answer_correct,negative_worded_stem,word_repeats_in_stem_and_correct_answer,avoid_logical_cues,lost_sequence,more_than_one_correct,complex_k_type,ambiguous_unclear_information,gratuitous_information_in_stem,avoid_convergence_cues,grammatical_cues_in_stem,vague_terms,unfocused_stem
Summation notation uses the symbol _____ to represent the sum of terms.,Σ,Π,∫,Σ,Δ,,,,,,,Pass,Pass,Pass,Fail,Pass,Pass,Pass,Pass,Pass,Pass,Pass,Pass,Pass,Pass,Pass,Pass,Pass,Pass,Pass
"In \(\sum_{i=s}^t a_i\), the variable \(i\) is called the _____.",index,limit,index,coefficient,term,,,,,,,Pass,Pass,Pass,Fail,Pass,Pass,Pass,Pass,Pass,Pass,Pass,Pass,Pass,Pass,Pass,Pass,Pass,Pass,Pass
Pulling out the last term from \(\sum_{k=m}^n a_k\) results in _____.,\(\sum_{k=m}^{n-1} a_k + a_n\),\(\sum_{k=m}^{n+1} a_k - a_n\),\(\sum_{k=m}^{n-1} a_k + a_n\),\(\sum_{k=m+1}^n a_k - a_m\),\(\sum_{k=m}^{n-1} a_k - a_n\),,,,,,,Pass,Pass,Pass,Fail,Pass,Pass,Pass,Pass,Pass,Pass,Pass,Pass,Pass,Pass,Pass,Pass,Pass,Pass,Pass
"When substituting \(i = k + 2\) in \(\sum_{k=1}^n (k+2)^3\), the new limits are _____.",from 3 to n+2,from 1 to n,from 3 to n+2,from -1 to n-2,from 0 to n+1,,,,,,,Pass,Pass,Pass,Fail,Pass,Pass,Pass,Pass,Pass,Pass,Pass,Pass,Pass,Pass,Pass,Pass,Pass,Pass,Pass
The closed form for the sum of an arithmetic sequence \(\sum_{k=0}^{n-1} (a + kd)\) is _____.,\(an + \frac{d(n-1)n}{2}\),\(an + d(n-1)n\),\(an + \frac{d(n-1)n}{2}\),\(\frac{a(r^n - 1)}{r - 1}\),\(a + nd\),,,,,,,Pass,Pass,Pass,Fail,Pass,Pass,Pass,Pass,Pass,Pass,Pass,Pass,Pass,Pass,Pass,Fail,Pass,Pass,Pass
"The closed form for the sum of a geometric sequence \(\sum_{k=0}^{n-1} a r^k\), where \(r \neq 1\), is _____.",\(\frac{a(r^n - 1)}{r - 1}\),\(a n r\),\(a \cdot r^{n-1}\),\(\frac{a(r^n - 1)}{r - 1}\),\(a + r n\),,,,,,,Pass,Pass,Pass,Fail,Pass,Pass,Fail,Pass,Pass,Pass,Pass,Pass,Pass,Pass,Pass,Pass,Pass,Pass,Pass
"If a summation includes the term for \(j=0\) and another does not, they are equal if _____.",the \(j=0\) term equals zero,all terms are positive,the \(j=0\) term equals zero,the summation is geometric,the upper limits differ by 1,,,,,,,Pass,Pass,Pass,Fail,Pass,Pass,Pass,Fail,Fail,Pass,Pass,Pass,Pass,Pass,Pass,Pass,Pass,Pass,Pass
"In the substitution \(j = i + 2\), the term \(a_i = \frac{1}{i+3}\) becomes \(\frac{1}{\text{_____}}\).",\(j + 1\),\(j + 3\),\(j - 1\),\(j + 1\),\(j - 3\),,,,,,,Pass,Pass,Pass,Fail,Pass,Pass,Pass,Pass,Pass,Pass,Pass,Pass,Pass,Pass,Pass,Pass,Pass,Pass,Pass
Why can the index variable in summations be replaced without changing the sum?,The index variable is arbitrary and only a placeholder,The index variable is arbitrary and only a placeholder,The index variable is fixed by the sequence formula,Changing the index changes the sum's value,The index variable must be \(i\),,,,,,,Pass,Pass,Pass,Pass,Pass,Fail,Pass,Fail,Pass,Pass,Pass,Pass,Pass,Pass,Pass,Pass,Pass,Pass,Pass
"For the sum \(\sum_{j=0}^n (j+1)^2\), the expanded form is _____.",\(1^2 + 2^2 + \cdots + (n+1)^2\),\(1^2 + 2^2 + \cdots + n^2\),\(0^2 + 1^2 + \cdots + n^2\),\(1^2 + 2^2 + \cdots + (n+1)^2\),\(2^2 + 3^2 + \cdots + (n+1)^2\),,,,,,,Pass,Pass,Pass,Fail,Pass,Pass,Pass,Pass,Pass,Pass,Pass,Pass,Pass,Pass,Pass,Fail,Pass,Pass,Pass
"When pulling out the last term from \(\sum_{j=0}^{n+2} 2^{j-1}\), the new summation is _____.",\(\sum_{j=0}^{n+1} 2^{j-1} + 2^{n+1}\),\(\sum_{j=0}^{n+1} 2^{j-1} + 2^{n+1}\),\(\sum_{j=0}^{n} 2^{j-1} + 2^{n+2}\),\(\sum_{j=0}^{n} 2^{j} + 2^{n+1}\),\(\sum_{j=0}^{n+2} 2^{j-1} + 2^{n}\),,,,,,,Pass,Pass,Pass,Fail,Pass,Pass,Pass,Pass,Pass,Pass,Pass,Pass,Pass,Pass,Pass,Pass,Pass,Pass,Pass
What does the lower limit in \(\sum_{i=s}^t a_i\) represent?,The first term index,The last term to add,The first term index,The total number of terms,The sum of terms,,,,,,,Pass,Pass,Pass,Pass,Pass,Pass,Pass,Pass,Pass,Pass,Pass,Pass,Pass,Pass,Pass,Pass,Pass,Pass,Pass
"In \(\sum_{j=1}^4 j^3\), what is the expanded form?",\(1^3 + 2^3 + 3^3 + 4^3\),\(1^3 + 3^3 + 4^3\),\(1^3 + 2^3 + 3^3 + 4^3\),\(4^3 + 3^3 + 2^3 + 1^3\),\(j^3\) for all \(j\),,,,,,,Pass,Pass,Pass,Pass,Pass,Pass,Pass,Pass,Pass,Pass,Pass,Pass,Pass,Pass,Pass,Fail,Pass,Pass,Pass
How can the last term be removed from \(\sum_{k=m}^n a_k\)?,Write as \(\sum_{k=m}^{n-1} a_k + a_n\),Subtract \(a_n\) from the sum,Write as \(\sum_{k=m}^{n-1} a_k + a_n\),Multiply the sum by \(a_n\),Replace \(n\) with \(n+1\),,,,,,,Pass,Pass,Pass,Pass,Pass,Pass,Fail,Pass,Pass,Pass,Pass,Pass,Pass,Pass,Pass,Pass,Pass,Pass,Pass
"If \(i = k + 2\), what is the new summation limits for \(\sum_{k=1}^n (k+2)^3\)?",\(i=3 \text{ to } n+2\),\(i=1 \text{ to } n\),\(i=3 \text{ to } n+2\),\(i=0 \text{ to } n-2\),\(i=2 \text{ to } n+1\),,,,,,,Pass,Pass,Pass,Pass,Pass,Pass,Pass,Pass,Pass,Pass,Pass,Pass,Pass,Pass,Pass,Pass,Pass,Pass,Pass
Which closed form calculates \(\sum_{k=0}^{n-1} (a + kd)\) for an arithmetic sequence?,\(an + \frac{d(n-1)n}{2}\),\(an + d(n-1)n\),\(an + \frac{d(n-1)n}{2}\),\(\frac{a(r^n-1)}{r-1}\),\(a + d + n\),,,,,,,Pass,Pass,Pass,Pass,Pass,Pass,Pass,Pass,Pass,Pass,Pass,Pass,Pass,Pass,Pass,Fail,Pass,Pass,Pass
What is the closed form for \(\sum_{k=0}^{n-1} a r^k\) with \(r \neq 1\)?,\(\frac{a(r^n-1)}{r-1}\),\(a r^n\),\(\frac{a(r^n-1)}{r-1}\),\(a + r + n\),\(a n r\),,,,,,,Pass,Pass,Pass,Pass,Pass,Pass,Pass,Pass,Pass,Fail,Pass,Pass,Pass,Pass,Pass,Pass,Pass,Pass,Pass
Pulling out the last term of \(\sum_{i=1}^{15} i\) gives \(\sum_{i=1}^{_____} i + _____\).,"14, 15","15, 16","14, 15","16, 17","13, 14",,,,,,,Pass,Pass,Pass,Fail,Pass,Pass,Pass,Pass,Pass,Pass,Pass,Pass,Pass,Pass,Pass,Pass,Pass,Pass,Pass
"When substituting \(j = i + 2\) in \(\sum_{i=3}^{21} \frac{1}{i+3}\), what is the new lower limit?",5,3,21,5,23,,,,,,,Pass,Pass,Pass,Pass,Pass,Pass,Pass,Pass,Pass,Fail,Fail,Pass,Pass,Pass,Pass,Pass,Pass,Pass,Pass
"Why can the index variable in summation notation be changed (e.g., \(j\) to \(k\)) without changing the sum’s value?",Index variables are placeholders and can be renamed,Index variables are placeholders and can be renamed,Changing variables reverses the sum,It changes the sequence terms,It changes the limits,,,,,,,Fail,Pass,Pass,Pass,Pass,Pass,Fail,Fail,Fail,Pass,Pass,Pass,Pass,Pass,Pass,Pass,Pass,Pass,Pass
"What is the sum of the first 7 terms of the arithmetic sequence \(5, 8, 11, \ldots\) using the closed form?",98,98,35,70,84,,,,,,,Pass,Pass,Pass,Pass,Pass,Pass,Pass,Pass,Pass,Pass,Fail,Pass,Pass,Pass,Pass,Pass,Pass,Pass,Pass
What does the expression \(\sum_{k=0}^{n} (k^2-4k+1)\) become when the last term is pulled out?,\(\sum_{k=0}^{n-1} (k^2-4k+1) + n^2 - 4n + 1\),\(\sum_{k=0}^{n-1} (k^2-4k+1) + n^2 - 4n + 1\),\(\sum_{k=0}^{n+1} (k^2-4k+1) + n^2\),\(\sum_{k=1}^{n} (k^2-4k+1) - n^2\),\(\sum_{k=1}^{n-1} (k^2-4k+1) + n\),,,,,,,Pass,Pass,Pass,Pass,Pass,Pass,Pass,Pass,Pass,Pass,Pass,Pass,Pass,Pass,Pass,Pass,Pass,Pass,Pass